{
  "business_id": "react-template-com",
  "domain": "react-template.com",
  "crawled_at": "2025-10-12T03:15:25.524356Z",
  "pages_visited": 2,
  "fields": {
    "brand_name": {
      "value": "React Templates & Themes",
      "confidence": 0.42,
      "provenance": [
        {
          "url": "https://react-template.com",
          "path": "title"
        }
      ],
      "notes": "full page title"
    },
    "location": {
      "value": null,
      "confidence": 0.0,
      "provenance": [],
      "notes": "not found"
    },
    "email": {
      "value": "ritirathod0@gmail.com",
      "confidence": 1.0,
      "provenance": [
        {
          "url": "https://react-template.com",
          "path": "a[href^='mailto:']"
        }
      ],
      "notes": "MX valid"
    },
    "phone": {
      "value": null,
      "confidence": 0.0,
      "provenance": [],
      "notes": "not found"
    },
    "socials": {
      "value": null,
      "confidence": 0.0,
      "provenance": [],
      "notes": "found 0 platforms"
    },
    "services": {
      "value": null,
      "confidence": 0.0,
      "provenance": [],
      "notes": "not found"
    },
    "brand_colors": {
      "value": [
        "#2F8EA1",
        "#4D6A73"
      ],
      "confidence": 0.66,
      "provenance": [
        {
          "url": "https://react-template.com",
          "path": "logo_palette"
        }
      ],
      "notes": "AA vs white & black"
    },
    "logo": {
      "value": "assets\\logo.png",
      "confidence": 0.72,
      "provenance": [
        {
          "url": "https://react-template.com",
          "path": "img[class*='logo']"
        }
      ],
      "notes": "220x26"
    },
    "background": {
      "value": "Download the top React templates, React dashboard, and React themes. It included a free and premium dashboard, landing page, e-commerce site, UI kit, and more.",
      "confidence": 0.48,
      "provenance": [
        {
          "url": "https://react-template.com",
          "path": "meta[name='description']"
        }
      ],
      "notes": "from meta description"
    },
    "slogan": {
      "value": "React Templates & Themes",
      "confidence": 0.42,
      "provenance": [
        {
          "url": "https://react-template.com",
          "path": "title"
        }
      ],
      "notes": "from page title"
    }
  },
  "candidates": {
    "brand_name": [
      {
        "value": "React Templates & Themes",
        "score": 0.42,
        "provenance": [
          {
            "url": "https://react-template.com",
            "path": "title"
          }
        ],
        "notes": "full page title"
      },
      {
        "value": "React Templates & Themes",
        "score": 0.42,
        "provenance": [
          {
            "url": "https://react-template.com/",
            "path": "title"
          }
        ],
        "notes": "full page title"
      }
    ],
    "location": [],
    "email": [
      {
        "value": "ritirathod0@gmail.com",
        "score": 1.0,
        "provenance": [
          {
            "url": "https://react-template.com",
            "path": "a[href^='mailto:']"
          }
        ],
        "notes": "MX valid"
      },
      {
        "value": "ritirathod0@gmail.com",
        "score": 1.0,
        "provenance": [
          {
            "url": "https://react-template.com/",
            "path": "a[href^='mailto:']"
          }
        ],
        "notes": "MX valid"
      }
    ],
    "phone": [],
    "socials": {
      "facebook": [],
      "instagram": [],
      "linkedin": [],
      "x": [],
      "youtube": [],
      "tiktok": [],
      "yelp": []
    },
    "services": [],
    "brand_colors": [
      {
        "value": [
          "#2F8EA1",
          "#4D6A73"
        ],
        "score": 0.6599999999999999,
        "provenance": [
          {
            "url": "https://react-template.com",
            "path": "logo_palette"
          }
        ],
        "notes": "AA vs white & black"
      }
    ],
    "logo": [
      {
        "value": "https://react-template.com/_next/image?url=%2Fassets%2Fimages%2Flogo.png&w=640&q=75",
        "score": 0.7225,
        "provenance": [
          {
            "url": "https://react-template.com",
            "path": "img[class*='logo']"
          }
        ],
        "notes": "220x26"
      },
      {
        "value": "https://react-template.com/_next/image?url=%2Fassets%2Fimages%2Fplus.png&w=32&q=75",
        "score": 0.6000000000000001,
        "provenance": [
          {
            "url": "https://react-template.com",
            "path": "header img"
          }
        ],
        "notes": "12x12"
      },
      {
        "value": "https://react-template.com/_next/image?url=%2Fassets%2Fimages%2Flogo.png&w=640&q=75",
        "score": 0.7225,
        "provenance": [
          {
            "url": "https://react-template.com/",
            "path": "img[class*='logo']"
          }
        ],
        "notes": "220x26"
      },
      {
        "value": "https://react-template.com/_next/image?url=%2Fassets%2Fimages%2Fplus.png&w=32&q=75",
        "score": 0.6000000000000001,
        "provenance": [
          {
            "url": "https://react-template.com/",
            "path": "header img"
          }
        ],
        "notes": "12x12"
      }
    ],
    "background": [
      {
        "value": "Download the top React templates, React dashboard, and React themes. It included a free and premium dashboard, landing page, e-commerce site, UI kit, and more.",
        "score": 0.48,
        "provenance": [
          {
            "url": "https://react-template.com",
            "path": "meta[name='description']"
          }
        ],
        "notes": "from meta description"
      }
    ],
    "slogan": [
      {
        "value": "React Templates & Themes",
        "score": 0.42,
        "provenance": [
          {
            "url": "https://react-template.com",
            "path": "title"
          }
        ],
        "notes": "from page title"
      }
    ]
  }
}