{
  "business_id": "example-com-2025-10-19T22-57-36",
  "domain": "example.com",
  "crawled_at": "2025-10-19T22:57:37.456711",
  "pages_visited": 1,
  "fields": {
    "brand_name": {
      "value": "Example Domain",
      "confidence": 0.8,
      "provenance": [
        {
          "url": "https://example.com",
          "path": "title"
        }
      ],
      "notes": "Extracted from title",
      "candidates": [
        {
          "value": "Example Domain",
          "confidence": 0.8,
          "source": "title",
          "provenance": [
            {
              "url": "https://example.com",
              "path": "title"
            }
          ]
        },
        {
          "value": "Example Domain",
          "confidence": 0.7,
          "source": "h1",
          "provenance": [
            {
              "url": "https://example.com",
              "path": "h1"
            }
          ]
        }
      ]
    },
    "location": {
      "value": null,
      "confidence": 0.0,
      "provenance": [],
      "notes": "not found",
      "candidates": []
    },
    "email": {
      "value": null,
      "confidence": 0.0,
      "provenance": [],
      "notes": "not found",
      "candidates": []
    },
    "phone": {
      "value": null,
      "confidence": 0.0,
      "provenance": [],
      "notes": "not found",
      "candidates": []
    },
    "socials": {
      "value": null,
      "confidence": 0.0,
      "provenance": [],
      "notes": "not found",
      "candidates": []
    },
    "services": {
      "value": null,
      "confidence": 0.0,
      "provenance": [],
      "notes": "not found",
      "candidates": []
    },
    "brand_colors": {
      "value": [
        "#1E40AF",
        "#3B82F6"
      ],
      "confidence": 0.2,
      "provenance": [
        {
          "url": "https://example.com",
          "path": "default"
        }
      ],
      "notes": "Extracted 2 colors",
      "candidates": [
        {
          "value": [
            "#3B82F6",
            "#1E40AF"
          ],
          "confidence": 0.2,
          "source": "default",
          "provenance": [
            {
              "url": "https://example.com",
              "path": "default"
            }
          ]
        }
      ]
    },
    "logo": {
      "value": null,
      "confidence": 0.0,
      "provenance": [],
      "notes": "not found",
      "candidates": []
    },
    "background": {
      "value": "This domain is for use in documentation examples without needing permission. Avoid use in operations.Learn more",
      "confidence": 0.6,
      "provenance": [
        {
          "url": "https://example.com",
          "path": "p"
        }
      ],
      "notes": "Extracted from paragraph",
      "candidates": [
        {
          "value": "This domain is for use in documentation examples without needing permission. Avoid use in operations.Learn more",
          "confidence": 0.6,
          "source": "paragraph",
          "provenance": [
            {
              "url": "https://example.com",
              "path": "p"
            }
          ]
        }
      ]
    },
    "slogan": {
      "value": null,
      "confidence": 0.0,
      "provenance": [],
      "notes": "not found",
      "candidates": []
    }
  },
  "candidates": {
    "brand_name": [
      {
        "value": "Example Domain",
        "confidence": 0.8,
        "source": "title",
        "provenance": [
          {
            "url": "https://example.com",
            "path": "title"
          }
        ]
      },
      {
        "value": "Example Domain",
        "confidence": 0.7,
        "source": "h1",
        "provenance": [
          {
            "url": "https://example.com",
            "path": "h1"
          }
        ]
      }
    ],
    "location": [],
    "email": [],
    "phone": [],
    "socials": [],
    "services": [],
    "brand_colors": [
      {
        "value": [
          "#3B82F6",
          "#1E40AF"
        ],
        "confidence": 0.2,
        "source": "default",
        "provenance": [
          {
            "url": "https://example.com",
            "path": "default"
          }
        ]
      }
    ],
    "logo": [],
    "background": [
      {
        "value": "This domain is for use in documentation examples without needing permission. Avoid use in operations.Learn more",
        "confidence": 0.6,
        "source": "paragraph",
        "provenance": [
          {
            "url": "https://example.com",
            "path": "p"
          }
        ]
      }
    ],
    "slogan": []
  }
}