{
  "business_id": "www-northshoreexteriorupkeep-com-2025-10-19T23-07-50",
  "domain": "www.northshoreexteriorupkeep.com",
  "crawled_at": "2025-10-19T23:07:51.815064",
  "pages_visited": 1,
  "fields": {
    "brand_name": {
      "value": "Northshore Exterior Upkeep",
      "confidence": 0.75,
      "provenance": [
        {
          "url": "https://www.northshoreexteriorupkeep.com",
          "path": "h1"
        }
      ],
      "notes": "Extracted from h1",
      "candidates": [
        {
          "value": "Northshore Exterior Upkeep",
          "confidence": 0.75,
          "source": "h1",
          "provenance": [
            {
              "url": "https://www.northshoreexteriorupkeep.com",
              "path": "h1"
            }
          ]
        }
      ]
    },
    "location": {
      "value": null,
      "confidence": 0.0,
      "provenance": [],
      "notes": "not found",
      "candidates": []
    },
    "email": {
      "value": "northshoreexteriorupkeep@gmail.com",
      "confidence": 0.76,
      "provenance": [
        {
          "url": "https://www.northshoreexteriorupkeep.com",
          "path": "text_content"
        }
      ],
      "notes": "Extracted from text_content",
      "candidates": [
        {
          "value": "northshoreexteriorupkeep@gmail.com",
          "confidence": 0.76,
          "source": "text_content",
          "provenance": [
            {
              "url": "https://www.northshoreexteriorupkeep.com",
              "path": "text_content"
            }
          ]
        }
      ]
    },
    "phone": {
      "value": " (985)662-8005",
      "confidence": 0.76,
      "provenance": [
        {
          "url": "https://www.northshoreexteriorupkeep.com",
          "path": "text_content"
        }
      ],
      "notes": "Extracted from text_content",
      "candidates": [
        {
          "value": " (985)662-8005",
          "confidence": 0.76,
          "source": "text_content",
          "provenance": [
            {
              "url": "https://www.northshoreexteriorupkeep.com",
              "path": "text_content"
            }
          ]
        },
        {
          "value": " 985-363-7887",
          "confidence": 0.76,
          "source": "text_content",
          "provenance": [
            {
              "url": "https://www.northshoreexteriorupkeep.com",
              "path": "text_content"
            }
          ]
        },
        {
          "value": "662-8005",
          "confidence": 0.6000000000000001,
          "source": "text_content",
          "provenance": [
            {
              "url": "https://www.northshoreexteriorupkeep.com",
              "path": "text_content"
            }
          ]
        },
        {
          "value": "985-363-7887",
          "confidence": 0.76,
          "source": "text_content",
          "provenance": [
            {
              "url": "https://www.northshoreexteriorupkeep.com",
              "path": "text_content"
            }
          ]
        }
      ]
    },
    "socials": {
      "value": null,
      "confidence": 0.0,
      "provenance": [],
      "notes": "not found",
      "candidates": []
    },
    "services": {
      "value": "pressure wash, Pressure washing, soft washing",
      "confidence": 0.7,
      "provenance": [
        {
          "url": "https://www.northshoreexteriorupkeep.com",
          "path": "service_descriptions"
        }
      ],
      "notes": "Extracted from service_descriptions",
      "candidates": [
        {
          "value": "pressure wash, Pressure washing, soft washing",
          "confidence": 0.7,
          "source": "service_descriptions",
          "provenance": [
            {
              "url": "https://www.northshoreexteriorupkeep.com",
              "path": "service_descriptions"
            }
          ]
        }
      ]
    },
    "brand_colors": {
      "value": [
        "#3B82F6",
        "#1E40AF"
      ],
      "confidence": 0.2,
      "provenance": [
        {
          "url": "https://www.northshoreexteriorupkeep.com",
          "path": "default"
        },
        {
          "url": "https://www.northshoreexteriorupkeep.com",
          "path": "default"
        }
      ],
      "notes": "Extracted 2 colors",
      "candidates": [
        {
          "value": "#3B82F6",
          "confidence": 0.2,
          "source": "default",
          "provenance": [
            {
              "url": "https://www.northshoreexteriorupkeep.com",
              "path": "default"
            }
          ]
        },
        {
          "value": "#1E40AF",
          "confidence": 0.2,
          "source": "default",
          "provenance": [
            {
              "url": "https://www.northshoreexteriorupkeep.com",
              "path": "default"
            }
          ]
        }
      ]
    },
    "logo": {
      "value": null,
      "confidence": 0.0,
      "provenance": [],
      "notes": "not found",
      "candidates": []
    },
    "background": {
      "value": "We use Eco friendly chemicals that are safe from the environment, and we use soft washing method so to not damage the property",
      "confidence": 0.6,
      "provenance": [
        {
          "url": "https://www.northshoreexteriorupkeep.com",
          "path": "p"
        }
      ],
      "notes": "Extracted from paragraph",
      "candidates": [
        {
          "value": "We use Eco friendly chemicals that are safe from the environment, and we use soft washing method so to not damage the property",
          "confidence": 0.6,
          "source": "paragraph",
          "provenance": [
            {
              "url": "https://www.northshoreexteriorupkeep.com",
              "path": "p"
            }
          ]
        }
      ]
    },
    "slogan": {
      "value": null,
      "confidence": 0.0,
      "provenance": [],
      "notes": "not found",
      "candidates": []
    }
  },
  "candidates": {
    "brand_name": [
      {
        "value": "Northshore Exterior Upkeep",
        "confidence": 0.75,
        "source": "h1",
        "provenance": [
          {
            "url": "https://www.northshoreexteriorupkeep.com",
            "path": "h1"
          }
        ]
      }
    ],
    "location": [],
    "email": [
      {
        "value": "northshoreexteriorupkeep@gmail.com",
        "confidence": 0.76,
        "source": "text_content",
        "provenance": [
          {
            "url": "https://www.northshoreexteriorupkeep.com",
            "path": "text_content"
          }
        ]
      }
    ],
    "phone": [
      {
        "value": " (985)662-8005",
        "confidence": 0.76,
        "source": "text_content",
        "provenance": [
          {
            "url": "https://www.northshoreexteriorupkeep.com",
            "path": "text_content"
          }
        ]
      },
      {
        "value": " 985-363-7887",
        "confidence": 0.76,
        "source": "text_content",
        "provenance": [
          {
            "url": "https://www.northshoreexteriorupkeep.com",
            "path": "text_content"
          }
        ]
      },
      {
        "value": "662-8005",
        "confidence": 0.6000000000000001,
        "source": "text_content",
        "provenance": [
          {
            "url": "https://www.northshoreexteriorupkeep.com",
            "path": "text_content"
          }
        ]
      },
      {
        "value": "985-363-7887",
        "confidence": 0.76,
        "source": "text_content",
        "provenance": [
          {
            "url": "https://www.northshoreexteriorupkeep.com",
            "path": "text_content"
          }
        ]
      }
    ],
    "socials": [],
    "services": [
      {
        "value": "pressure wash, Pressure washing, soft washing",
        "confidence": 0.7,
        "source": "service_descriptions",
        "provenance": [
          {
            "url": "https://www.northshoreexteriorupkeep.com",
            "path": "service_descriptions"
          }
        ]
      }
    ],
    "brand_colors": [
      {
        "value": "#3B82F6",
        "confidence": 0.2,
        "source": "default",
        "provenance": [
          {
            "url": "https://www.northshoreexteriorupkeep.com",
            "path": "default"
          }
        ]
      },
      {
        "value": "#1E40AF",
        "confidence": 0.2,
        "source": "default",
        "provenance": [
          {
            "url": "https://www.northshoreexteriorupkeep.com",
            "path": "default"
          }
        ]
      }
    ],
    "logo": [],
    "background": [
      {
        "value": "We use Eco friendly chemicals that are safe from the environment, and we use soft washing method so to not damage the property",
        "confidence": 0.6,
        "source": "paragraph",
        "provenance": [
          {
            "url": "https://www.northshoreexteriorupkeep.com",
            "path": "p"
          }
        ]
      }
    ],
    "slogan": []
  }
}